{
  "display_name": "v32_weather_f64_uts",
  "expected": {
    "canonical_raw_bits": 524288,
    "n_rows": 8192,
    "semantic_content_sha256": "de1f707a088e14ed7b52bfb80a84856247021ae50fdbe1e9d7f63d0d31b901c1",
    "shape": [
      8192
    ]
  },
  "file": {
    "bytes": 66776,
    "format": "canonical",
    "path": "artifacts/comparisons/v32_20261010/sources/v32_weather_f64_uts.tscb",
    "sha256": "217bee1f5eac7fa0f8cff9867c046b488399b628482d69f086d659905a421f5a"
  },
  "key": "v32_weather_f64_uts",
  "license": {
    "spdx": "UNSPECIFIED",
    "status": "REVIEW_REQUIRED"
  },
  "logical": {
    "axes": [
      "time"
    ],
    "n_rows": 8192,
    "nan_is_null": false,
    "schema_version": "tscb.logical-view.v2",
    "timestamp": {
      "epoch": "NOT_APPLICABLE",
      "order_policy": "PRESERVE",
      "origin": "NONE",
      "present": false,
      "unit": "NOT_APPLICABLE"
    },
    "topology": "UTS",
    "validity_shape": "NONE",
    "value_columns": [
      {
        "display_name": "p (mbar)",
        "dtype": "<f8",
        "entity": "weather_station",
        "feature": "p (mbar)",
        "name": "p (mbar)",
        "shape": [
          8192
        ],
        "strides": [
          8
        ],
        "unit": "FROM_RAW_HEADER"
      }
    ],
    "value_shape": [
      8192
    ]
  },
  "parser": {
    "identity_policy": "tscb.dataset-content.v1",
    "name": "tscb.canonical",
    "version": "1"
  },
  "schema_version": "tscb.canonical-source-manifest.v1",
  "source": {
    "notes": "{\"domain_proof\": {\"checked_values\": 8192, \"finite\": true, \"lossy_transform\": false, \"maximum\": [\"1020.07\"], \"minimum\": [\"963.3\"], \"original_dtype\": \"<f8\"}, \"first_party_project_reference\": \"https://www.bgc-jena.mpg.de/wetter/\", \"generation_spec\": {\"dtype_policy\": \"PRESERVE_ORIGINAL_F64\", \"kind\": \"REAL_VALUE_WINDOW\", \"parent_dataset_id\": \"v2:dataset:sha256:d2005d6eaf1ce1dd29bd9417237558fda0c9b8bdbdf415c948a74d2d444aac5c\", \"parent_file_sha256\": \"34ee981d07313e51da2a50bb600072c8ae4a69cb4b0651f4cb93a069d7a2ba63\", \"row_start\": 0, \"row_stop\": 8192, \"selected_columns\": [\"p (mbar)\"], \"source_key\": \"weather\", \"timestamp_policy\": \"VALUE_TRACK_SOURCE_TIMESTAMPS_OUTSIDE_OBJECT\"}, \"source_lineage_authentication\": \"LOCAL_MANIFEST_ONLY_NOT_EXTERNALLY_AUTHENTICATED\", \"source_manifest\": \"registry/datasets/weather.json\", \"source_sha256\": \"34ee981d07313e51da2a50bb600072c8ae4a69cb4b0651f4cb93a069d7a2ba63\"}",
    "retrieved_at": "UNSPECIFIED",
    "uri": "local:datasets/weather.csv"
  },
  "split": {
    "learned_eligible": false,
    "policy": "TEST",
    "reason": "Frozen whole-object CPU comparison; no learned split or source generalization claimed."
  }
}
