{
  "display_name": "v32_etth1_u8_bytes_n4096_c1",
  "expected": {
    "canonical_raw_bits": 262144,
    "n_rows": 32768,
    "semantic_content_sha256": "daf058e2f5f82c93745002cda85b828068481d38da34a4bdfe877477b096ac1b",
    "shape": [
      32768
    ]
  },
  "file": {
    "bytes": 34010,
    "format": "canonical",
    "path": "artifacts/comparisons/v32_20261010/sources/v32_etth1_u8_bytes_n4096_c1.tscb",
    "sha256": "70cb182f7ff4af28a519f986dd9181cc0d3cc2722d13cd64f106b96d02ca3e48"
  },
  "key": "v32_etth1_u8_bytes_n4096_c1",
  "license": {
    "spdx": "UNSPECIFIED",
    "status": "REVIEW_REQUIRED"
  },
  "logical": {
    "axes": [
      "time"
    ],
    "n_rows": 32768,
    "nan_is_null": false,
    "schema_version": "tscb.logical-view.v2",
    "timestamp": {
      "epoch": "NOT_APPLICABLE",
      "order_policy": "PRESERVE",
      "origin": "NONE",
      "present": false,
      "unit": "NOT_APPLICABLE"
    },
    "topology": "UTS",
    "validity_shape": "NONE",
    "value_columns": [
      {
        "display_name": "serialized-u8",
        "dtype": "|u1",
        "entity": "etth1",
        "feature": "source-value-bytes",
        "name": "serialized-u8",
        "shape": [
          32768
        ],
        "strides": [
          1
        ],
        "unit": "BYTE"
      }
    ],
    "value_shape": [
      32768
    ]
  },
  "parser": {
    "identity_policy": "tscb.dataset-content.v1",
    "name": "tscb.canonical",
    "version": "1"
  },
  "schema_version": "tscb.canonical-source-manifest.v1",
  "source": {
    "notes": "{\"domain_proof\": {\"actual_maximum\": 255, \"actual_minimum\": 0, \"allowed_range\": [0, 255], \"byte_count\": 32768, \"comparison_recovery_domain\": \"ORIGINAL_UINT8_BYTE_OBJECT_ONLY\", \"injective_byte_serialization\": true, \"logical_channels\": 1, \"logical_rank\": 1, \"lossy_transform\": false, \"original_dtype\": \"|u1\", \"source_byte_count\": 32768, \"source_column_boundaries_predeclared\": true}, \"first_party_project_reference\": \"https://github.com/zhouhaoyi/ETDataset\", \"generation_spec\": {\"domain_limit_bytes\": 131072, \"floating_object_recovery_claim\": false, \"kind\": \"REAL_SENSOR_F64_BYTES_TO_UINT8_OBJECT\", \"model_symbol_task\": false, \"original_comparison_object\": \"UINT8_BYTE_STREAM\", \"parent_dataset_id\": \"v2:dataset:sha256:206d91b396c6f28b9bce55f3e53fa8f89a746ed178d38c8da273a31ddfad62f2\", \"parent_file_sha256\": \"f18de3ad269cef59bb07b5438d79bb3042d3be49bdeecf01c1cd6d29695ee066\", \"row_start\": 0, \"row_stop\": 4096, \"selected_columns\": [\"HUFL\"], \"serialization\": \"COLUMN_ORDER_ORIGINAL_LE_F64_BYTES_AS_UINT8_V1\", \"source_key\": \"etth1\", \"source_manifest\": \"registry/datasets/etth1.json\", \"source_payload_sha256\": \"6ee22177c087d3997455d0f596dd70a7a976439f7d8995202200a68545aef023\", \"split_policy\": \"PREDECLARED_TEST_SOURCE_WINDOW_NO_RESULT_SELECTION\", \"timestamp_policy\": \"SOURCE_TIMESTAMPS_OUTSIDE_UINT8_OBJECT\", \"window_reason\": \"Existing Sprintz uint8 UTS max_n is 131072; 4096 rows x 4 source f64 columns serialize to at most 131072 bytes.\", \"window_selection_rule\": \"PREDECLARED_CAPABILITY_BOUND_NO_RESULT_SELECTION\"}, \"source_lineage_authentication\": \"LOCAL_MANIFEST_ONLY_NOT_EXTERNALLY_AUTHENTICATED\", \"source_manifest\": \"registry/datasets/etth1.json\", \"source_sha256\": \"f18de3ad269cef59bb07b5438d79bb3042d3be49bdeecf01c1cd6d29695ee066\"}",
    "retrieved_at": "UNSPECIFIED",
    "uri": "local:datasets/ETTh1.csv"
  },
  "split": {
    "learned_eligible": false,
    "policy": "TEST",
    "reason": "Frozen whole-object CPU comparison; no learned split or source generalization claimed."
  }
}
