{
  "display_name": "v32_t_missing_required_timestamp_test_v2",
  "expected": {
    "canonical_raw_bits": 1088,
    "n_rows": 17,
    "semantic_content_sha256": "98a919456a8fbaf45b8b5348d12614262d8034d46bbfc5e0161f038a512d5133",
    "shape": [
      17
    ]
  },
  "file": {
    "bytes": 1356,
    "format": "canonical",
    "path": "artifacts/comparisons/v32_20261010/sources/v32_t_missing_required_timestamp_test_v2.tscb",
    "sha256": "bfcf6033a2654a3ae0fbc21df775f7a9a0ca13ba1b0c9640094be44a0011da64"
  },
  "key": "v32_t_missing_required_timestamp_test_v2",
  "license": {
    "spdx": "CC0-1.0",
    "status": "RUN_ALLOWED"
  },
  "logical": {
    "axes": [
      "time"
    ],
    "n_rows": 17,
    "nan_is_null": false,
    "schema_version": "tscb.logical-view.v2",
    "timestamp": {
      "epoch": "NOT_APPLICABLE",
      "order_policy": "PRESERVE",
      "origin": "NONE",
      "present": false,
      "unit": "NOT_APPLICABLE"
    },
    "topology": "UTS",
    "validity_shape": "NONE",
    "value_columns": [
      {
        "display_name": "synthetic-0",
        "dtype": "<f8",
        "entity": "synthetic",
        "feature": "channel-0",
        "name": "synthetic/000000",
        "shape": [
          17
        ],
        "strides": [
          8
        ],
        "unit": "UNSPECIFIED"
      }
    ],
    "value_shape": [
      17
    ]
  },
  "parser": {
    "identity_policy": "tscb.dataset-content.v2",
    "name": "tscb.canonical",
    "version": "2"
  },
  "schema_version": "tscb.canonical-source-manifest.v1",
  "source": {
    "notes": "{\"domain_proof\": {\"timestamp_present\": false}, \"generation_spec\": {\"dtype\": \"<f8\", \"floating_scale\": \"1/16\", \"formula_version\": \"1\", \"kind\": \"NEGATIVE_TASK_FIXTURE\", \"m\": 1, \"n\": 17, \"pattern\": \"constant\", \"reason\": \"MISSING_REQUIRED_TIMESTAMP\", \"rng\": \"numpy.PCG64\", \"seed\": 20261012}, \"source_lineage_authentication\": \"GENERATOR_FULL_SPEC\", \"source_manifest\": null, \"source_sha256\": null}",
    "retrieved_at": "LOCAL_GENERATED",
    "uri": "local:synthetic"
  },
  "split": {
    "learned_eligible": false,
    "policy": "TEST",
    "reason": "Fixed typed task; synthetic pilot is independent; no model training."
  }
}
