{
  "display_name": "v32_etth1_original_t_i64_4096_v2",
  "expected": {
    "canonical_raw_bits": 524288,
    "n_rows": 4096,
    "semantic_content_sha256": "8cb5afa87b3b82dafa5bf21b5b3d9004f762969ec1e0bea75caf10bb4cb48071",
    "shape": [
      4096
    ]
  },
  "file": {
    "bytes": 67067,
    "format": "canonical",
    "path": "artifacts/comparisons/v32_20261010/sources/v32_etth1_original_t_i64_4096_v2.tscb",
    "sha256": "4ca903582552082d5c462268c37b38093bc62f762c4eb80830f7b90af332beea"
  },
  "key": "v32_etth1_original_t_i64_4096_v2",
  "license": {
    "spdx": "UNSPECIFIED",
    "status": "REVIEW_REQUIRED"
  },
  "logical": {
    "axes": [
      "time"
    ],
    "n_rows": 4096,
    "nan_is_null": false,
    "schema_version": "tscb.logical-view.v2",
    "timestamp": {
      "dtype": "<i8",
      "epoch": "UNIX",
      "order_policy": "PRESERVE",
      "origin": "SOURCE_COLUMN",
      "present": true,
      "unit": "s"
    },
    "topology": "UTS",
    "validity_shape": "NONE",
    "value_columns": [
      {
        "display_name": "HUFL",
        "dtype": "<f8",
        "entity": "transformer",
        "feature": "HUFL",
        "name": "HUFL",
        "shape": [
          4096
        ],
        "strides": [
          8
        ],
        "unit": "UNSPECIFIED"
      }
    ],
    "value_shape": [
      4096
    ]
  },
  "parser": {
    "identity_policy": "tscb.dataset-content.v2",
    "name": "tscb.canonical",
    "version": "2"
  },
  "schema_version": "tscb.canonical-source-manifest.v1",
  "source": {
    "notes": "{\"domain_proof\": {\"count\": 4096, \"dtype\": \"<i8\", \"epoch\": \"UNIX\", \"sort_or_rebase_or_delta\": false, \"source_timestamp_column\": \"date\", \"task_raw_bits\": 262144, \"timestamp_bytes_unchanged\": true, \"unit\": \"s\", \"value_carrier_is_not_task_input\": true}, \"generation_spec\": {\"kind\": \"REAL_ORIGINAL_TIMESTAMP_WINDOW\", \"parent_dataset_id\": \"v2:dataset:sha256:206d91b396c6f28b9bce55f3e53fa8f89a746ed178d38c8da273a31ddfad62f2\", \"parent_file_sha256\": \"f18de3ad269cef59bb07b5438d79bb3042d3be49bdeecf01c1cd6d29695ee066\", \"row_start\": 4096, \"row_stop\": 8192, \"selected_value_carrier\": \"HUFL\", \"source_key\": \"etth1\", \"timestamp_policy\": \"PRESERVE_SOURCE_COLUMN_ORDER_VALUES_UNIT_EPOCH\", \"value_carrier_policy\": \"FIRST_ORIGINAL_VALUE_COLUMN_OUTSIDE_TIMESTAMP_TASK\"}, \"source_lineage_authentication\": \"LOCAL_MANIFEST_ONLY_NOT_EXTERNALLY_AUTHENTICATED\", \"source_manifest\": \"registry/datasets/etth1.json\", \"source_sha256\": \"f18de3ad269cef59bb07b5438d79bb3042d3be49bdeecf01c1cd6d29695ee066\"}",
    "retrieved_at": "UNSPECIFIED",
    "uri": "local:datasets/ETTh1.csv"
  },
  "split": {
    "learned_eligible": false,
    "policy": "TEST",
    "reason": "Fixed typed task; synthetic pilot is independent; no model training."
  }
}
