{
  "display_name": "v32_qual_f64_periodic_m1",
  "expected": {
    "canonical_raw_bits": 16448,
    "n_rows": 257,
    "semantic_content_sha256": "a4bc85c0e40b3dd1221778a5111146f64a46894ddeb98678f931d7896791a479",
    "shape": [
      257
    ]
  },
  "file": {
    "bytes": 3286,
    "format": "canonical",
    "path": "artifacts/comparisons/v32_20261010/sources/v32_qual_f64_periodic_m1.tscb",
    "sha256": "6c65779b6940949bbee287e81b92797513468ab8c71ea9eee15d738f961ff8e0"
  },
  "key": "v32_qual_f64_periodic_m1",
  "license": {
    "spdx": "CC0-1.0",
    "status": "RUN_ALLOWED"
  },
  "logical": {
    "axes": [
      "time"
    ],
    "n_rows": 257,
    "nan_is_null": false,
    "schema_version": "tscb.logical-view.v2",
    "timestamp": {
      "epoch": "NOT_APPLICABLE",
      "order_policy": "PRESERVE",
      "origin": "NONE",
      "present": false,
      "unit": "NOT_APPLICABLE"
    },
    "topology": "UTS",
    "validity_shape": "NONE",
    "value_columns": [
      {
        "display_name": "synthetic-0",
        "dtype": "<f8",
        "entity": "synthetic",
        "feature": "channel-0",
        "name": "synthetic/000000",
        "shape": [
          257
        ],
        "strides": [
          8
        ],
        "unit": "UNSPECIFIED"
      }
    ],
    "value_shape": [
      257
    ]
  },
  "parser": {
    "identity_policy": "tscb.dataset-content.v1",
    "name": "tscb.canonical",
    "version": "1"
  },
  "schema_version": "tscb.canonical-source-manifest.v1",
  "source": {
    "notes": "{\"domain_proof\": null, \"first_party_project_reference\": null, \"generation_spec\": {\"dtype\": \"<f8\", \"floating_scale\": \"1/16\", \"formula_version\": \"1\", \"kind\": \"SYNTHETIC\", \"m\": 1, \"n\": 257, \"pattern\": \"periodic\", \"rng\": \"numpy.PCG64\", \"seed\": 20261010}, \"source_lineage_authentication\": \"GENERATOR_FULL_SPEC\", \"source_manifest\": null, \"source_sha256\": null}",
    "retrieved_at": "LOCAL_GENERATED",
    "uri": "local:synthetic"
  },
  "split": {
    "learned_eligible": false,
    "policy": "VALIDATION",
    "reason": "Frozen whole-object CPU comparison; no learned split or source generalization claimed."
  }
}
