{
  "display_name": "v32_etth1_f64_uts_n4096",
  "expected": {
    "canonical_raw_bits": 262144,
    "n_rows": 4096,
    "semantic_content_sha256": "c78d2c15b1c28565dcfa136a3aa6d6ed09050428bcb35063b8540ebc019eca24",
    "shape": [
      4096
    ]
  },
  "file": {
    "bytes": 33988,
    "format": "canonical",
    "path": "artifacts/comparisons/v32_20261010/sources/v32_etth1_f64_uts_n4096.tscb",
    "sha256": "e4461db9aedf8b86f50f22393858f390a9f35099ec28b959674cafe5f5e77670"
  },
  "key": "v32_etth1_f64_uts_n4096",
  "license": {
    "spdx": "UNSPECIFIED",
    "status": "REVIEW_REQUIRED"
  },
  "logical": {
    "axes": [
      "time"
    ],
    "n_rows": 4096,
    "nan_is_null": false,
    "schema_version": "tscb.logical-view.v2",
    "timestamp": {
      "epoch": "NOT_APPLICABLE",
      "order_policy": "PRESERVE",
      "origin": "NONE",
      "present": false,
      "unit": "NOT_APPLICABLE"
    },
    "topology": "UTS",
    "validity_shape": "NONE",
    "value_columns": [
      {
        "display_name": "HUFL",
        "dtype": "<f8",
        "entity": "transformer",
        "feature": "HUFL",
        "name": "HUFL",
        "shape": [
          4096
        ],
        "strides": [
          8
        ],
        "unit": "UNSPECIFIED"
      }
    ],
    "value_shape": [
      4096
    ]
  },
  "parser": {
    "identity_policy": "tscb.dataset-content.v1",
    "name": "tscb.canonical",
    "version": "1"
  },
  "schema_version": "tscb.canonical-source-manifest.v1",
  "source": {
    "notes": "{\"domain_proof\": {\"checked_values\": 4096, \"finite\": true, \"lossy_transform\": false, \"maximum\": [\"23.643999099731445\"], \"minimum\": [\"0.0\"], \"original_dtype\": \"<f8\"}, \"first_party_project_reference\": \"https://github.com/zhouhaoyi/ETDataset\", \"generation_spec\": {\"domain_limit_bytes\": 131072, \"dtype_policy\": \"PRESERVE_ORIGINAL_F64\", \"kind\": \"REAL_VALUE_WINDOW\", \"parent_dataset_id\": \"v2:dataset:sha256:206d91b396c6f28b9bce55f3e53fa8f89a746ed178d38c8da273a31ddfad62f2\", \"parent_file_sha256\": \"f18de3ad269cef59bb07b5438d79bb3042d3be49bdeecf01c1cd6d29695ee066\", \"row_start\": 0, \"row_stop\": 4096, \"selected_columns\": [\"HUFL\"], \"source_key\": \"etth1\", \"source_manifest\": \"registry/datasets/etth1.json\", \"timestamp_policy\": \"VALUE_TRACK_SOURCE_TIMESTAMPS_OUTSIDE_OBJECT\", \"window_reason\": \"Existing FSE/Huff0 complete-object bound is 131072 bytes; 4096 rows x 4 original f64 columns fit without truncating output.\", \"window_selection_rule\": \"PREDECLARED_CAPABILITY_BOUND_NO_RESULT_SELECTION\"}, \"source_lineage_authentication\": \"LOCAL_MANIFEST_ONLY_NOT_EXTERNALLY_AUTHENTICATED\", \"source_manifest\": \"registry/datasets/etth1.json\", \"source_sha256\": \"f18de3ad269cef59bb07b5438d79bb3042d3be49bdeecf01c1cd6d29695ee066\"}",
    "retrieved_at": "UNSPECIFIED",
    "uri": "local:datasets/ETTh1.csv"
  },
  "split": {
    "learned_eligible": false,
    "policy": "TEST",
    "reason": "Frozen whole-object CPU comparison; no learned split or source generalization claimed."
  }
}
